{"id":1736741,"items":[{"id":1736742,"status":2,"title":"Page 3","order":0,"templateKey":null,"pageLinks":[]}],"metaTags":null,"order":"0","headHtml":null,"customCss":null,"headerHtml":"<section class=\"u-align-center-xs u-border-1 u-border-grey-25 u-clearfix u-grey-90 u-header u-block-c06b-1\" custom-posts-hash=\"[]\" data-style=\"header-search-menu-button\" data-post-id=\"2391033511\" data-section-properties=\"{&quot;grid-spacing&quot;:&quot;0&quot;,&quot;align&quot;:&quot;left&quot;,&quot;stretch&quot;:true}\" id=\"sec-d7ff\" data-source=\"\" data-id=\"c06b\">\n  <div class=\"u-clearfix u-sheet u-valign-middle u-block-c06b-2\">\n    <form action=\"#\" method=\"get\" class=\"u-border-1 u-border-grey-70 u-expanded-width-xs u-search u-search-right u-block-c06b-3\">\n      <button class=\"u-search-button\" type=\"submit\">\n        <span class=\"u-search-icon u-spacing-10 u-text-grey-40 u-block-c06b-4\">\n          <svg class=\"u-svg-link\" preserveAspectRatio=\"xMidYMin slice\" viewBox=\"0 0 56.966 56.966\" style=\"\"><use xmlns:xlink=\"http://www.w3.org/1999/xlink\" xlink:href=\"#svg-b04b\"></use></svg>\n          <svg xmlns=\"http://www.w3.org/2000/svg\" xmlns:xlink=\"http://www.w3.org/1999/xlink\" version=\"1.1\" id=\"svg-b04b\" x=\"0px\" y=\"0px\" viewBox=\"0 0 56.966 56.966\" style=\"enable-background:new 0 0 56.966 56.966;\" xml:space=\"preserve\" class=\"u-svg-content\"><path d=\"M55.146,51.887L41.588,37.786c3.486-4.144,5.396-9.358,5.396-14.786c0-12.682-10.318-23-23-23s-23,10.318-23,23  s10.318,23,23,23c4.761,0,9.298-1.436,13.177-4.162l13.661,14.208c0.571,0.593,1.339,0.92,2.162,0.92  c0.779,0,1.518-0.297,2.079-0.837C56.255,54.982,56.293,53.08,55.146,51.887z M23.984,6c9.374,0,17,7.626,17,17s-7.626,17-17,17  s-17-7.626-17-17S14.61,6,23.984,6z\"></path><g></g><g></g><g></g><g></g><g></g><g></g><g></g><g></g><g></g><g></g><g></g><g></g><g></g><g></g><g></g></svg>\n        </span>\n      </button>\n      <input class=\"u-search-input u-block-c06b-5\" type=\"search\" name=\"search\" value=\"\" placeholder=\"Search\">\n    </form>\n    <nav class=\"u-align-left u-menu u-menu-dropdown u-nav-spacing-25 u-offcanvas u-block-c06b-6\" data-responsive-from=\"XL\">\n      <div class=\"menu-collapse\">\n        <a class=\"u-button-style u-nav-link\" href=\"#\" style=\"padding: 4px 0px; font-size: calc(1em + 8px);\">\n          <svg class=\"u-svg-link\" preserveAspectRatio=\"xMidYMin slice\" viewBox=\"0 0 302 302\" style=\"\"><use xmlns:xlink=\"http://www.w3.org/1999/xlink\" xlink:href=\"#svg-7b92\"></use></svg>\n          <svg xmlns=\"http://www.w3.org/2000/svg\" xmlns:xlink=\"http://www.w3.org/1999/xlink\" version=\"1.1\" id=\"svg-7b92\" x=\"0px\" y=\"0px\" viewBox=\"0 0 302 302\" style=\"enable-background:new 0 0 302 302;\" xml:space=\"preserve\" class=\"u-svg-content\"><g><rect y=\"36\" width=\"302\" height=\"30\"></rect><rect y=\"236\" width=\"302\" height=\"30\"></rect><rect y=\"136\" width=\"302\" height=\"30\"></rect>\n</g><g></g><g></g><g></g><g></g><g></g><g></g><g></g><g></g><g></g><g></g><g></g><g></g><g></g><g></g><g></g></svg>\n        </a>\n      </div>\n      <div class=\"u-custom-menu u-nav-container\">\n        <ul class=\"u-nav u-unstyled u-block-c06b-18\"><li class=\"u-nav-item\"><a class=\"u-button-style u-nav-link u-text-active-palette-1-base u-text-hover-palette-2-base\" href=\"/Page-1.html\" data-page-id=\"102753\" style=\"padding: 10px 20px;\">Page 1</a><div class=\"fake u-nav-popup\"><ul class=\"u-h-spacing-20 u-nav u-unstyled u-v-spacing-10 u-block-c06b-19\"><li class=\"u-nav-item\"><a class=\"u-button-style u-nav-link u-white\" href=\"#\">Menu Item1</a></li><li class=\"u-nav-item\"><a class=\"u-button-style u-nav-link u-white\" href=\"#\">Menu Item2</a></li><li class=\"u-nav-item\"><a class=\"u-button-style u-nav-link u-white\" href=\"#\">Menu Item3</a></li></ul></div></li><li class=\"u-nav-item\"><a class=\"u-button-style u-nav-link u-text-active-palette-1-base u-text-hover-palette-2-base\" href=\"/Page-2.html\" data-page-id=\"105566\" style=\"padding: 10px 20px;\">Page 2</a></li><li class=\"u-nav-item\"><a class=\"u-button-style u-nav-link u-text-active-palette-1-base u-text-hover-palette-2-base\" href=\"/Page-3.html\" data-page-id=\"105574\" style=\"padding: 10px 20px;\">Page 3</a></li><li class=\"u-nav-item\"><a class=\"u-button-style u-nav-link u-text-active-palette-1-base u-text-hover-palette-2-base\" href=\"/Page-4.html\" data-page-id=\"229158\" style=\"padding: 10px 20px;\">Page 4</a></li></ul>\n      </div>\n      <div class=\"u-custom-menu u-nav-container-collapse\">\n        <div class=\"u-align-center u-black u-container-style u-inner-container-layout u-opacity u-opacity-95 u-sidenav u-block-c06b-8\"><div class=\"u-inner-container-layout u-sidenav-overflow\">\n          <div class=\"u-menu-close u-block-c06b-9\"></div>\n          <ul class=\"u-align-center u-nav u-popupmenu-items u-unstyled u-block-c06b-10\"><li class=\"u-nav-item\"><a class=\"u-button-style u-nav-link\" href=\"/Page-1.html\" data-page-id=\"102753\">Page 1</a>\n<div class=\"fake u-nav-popup\"><ul class=\"u-h-spacing-20 u-nav u-unstyled u-v-spacing-10 u-block-c06b-17\"><li class=\"u-nav-item\"><a class=\"u-button-style u-nav-link u-white\">Menu Item 1</a>\n</li><li class=\"u-nav-item\"><a class=\"u-button-style u-nav-link u-white\">Menu Item 2</a>\n</li><li class=\"u-nav-item\"><a class=\"u-button-style u-nav-link u-white\">Menu Item 3</a>\n</li></ul>\n</div></li></ul>\n        </div></div>\n        <div class=\"u-black u-menu-overlay u-opacity u-opacity-70\"></div>\n      </div>\n    </nav>\n  </div>\n  <style data-mode=\"XL\" data-visited=\"true\">@media (min-width: 1200px){ .u-block-c06b-1 {background-image: none}\n.u-block-c06b-2 {min-height: 74px}\n.u-block-c06b-3 {width: 200px; min-height: 38px; margin-top: 0px; margin-right: auto; margin-bottom: 0px; margin-left: 0px}\n.u-block-c06b-6 {font-family: size-14; margin-top: -35px; margin-right: 0px; margin-bottom: 3px; margin-left: auto}\n.u-block-c06b-18 {font-size: 1rem}\n.u-block-c06b-19 {font-size: 1rem}\n.u-block-c06b-10 {font-size: 1rem}\n.u-block-c06b-17 {font-size: 1rem} }</style>\n  <style data-mode=\"LG\" data-visited=\"true\">@media (max-width: 1199px) and (min-width: 992px){ .u-block-c06b-1 {background-image: none}\n.u-block-c06b-2 {min-height: 74px}\n.u-block-c06b-3 {width: 200px; height: auto; min-height: 38px; margin-top: 0px; margin-right: auto; margin-bottom: 0px; margin-left: 0px}\n.u-block-c06b-6 {width: auto; margin-top: -32px; margin-right: 0px; margin-bottom: 0px; margin-left: auto; font-family: size-14}\n.u-block-c06b-18 {font-size: 1rem}\n.u-block-c06b-19 {font-size: 1rem}\n.u-block-c06b-10 {font-size: 1rem}\n.u-block-c06b-17 {font-size: 1rem} }</style>\n  <style data-mode=\"MD\" data-visited=\"true\">@media (max-width: 991px) and (min-width: 768px){ .u-block-c06b-1 {background-image: none}\n.u-block-c06b-2 {min-height: 74px}\n.u-block-c06b-3 {width: 200px; height: auto; min-height: 38px; margin-top: 0px; margin-right: 58px; margin-bottom: 0px; margin-left: 0px}\n.u-block-c06b-6 {width: auto; margin-top: -34px; margin-right: 0px; margin-bottom: 4px; margin-left: auto; font-family: size-14}\n.u-block-c06b-18 {font-size: 1rem}\n.u-block-c06b-19 {font-size: 1rem}\n.u-block-c06b-10 {font-size: 1rem}\n.u-block-c06b-17 {font-size: 1rem} }</style>\n  <style data-mode=\"SM\" data-visited=\"true\">@media (max-width: 767px) and (min-width: 576px){ .u-block-c06b-1 {background-image: none}\n.u-block-c06b-2 {min-height: 74px}\n.u-block-c06b-3 {width: 200px; height: auto; min-height: 38px; margin-top: 0px; margin-right: 58px; margin-bottom: 0px; margin-left: 0px}\n.u-block-c06b-6 {width: auto; margin-top: -35px; margin-right: 0px; margin-bottom: 3px; margin-left: auto; font-family: size-14}\n.u-block-c06b-18 {font-size: 1rem}\n.u-block-c06b-19 {font-size: 1rem}\n.u-block-c06b-10 {font-size: 1rem}\n.u-block-c06b-17 {font-size: 1rem} }</style>\n  <style data-mode=\"XS\" data-visited=\"true\">@media (max-width: 575px){ .u-block-c06b-1 {background-image: none}\n.u-block-c06b-2 {min-height: 118px}\n.u-block-c06b-3 {height: auto; min-height: 38px; margin-top: 0px; margin-bottom: 0px}\n.u-block-c06b-6 {width: auto; margin-top: -35px; margin-right: auto; margin-bottom: 3px; margin-left: 158px; font-family: size-14}\n.u-block-c06b-18 {font-size: 1rem}\n.u-block-c06b-19 {font-size: 1rem}\n.u-block-c06b-10 {font-size: 1rem}\n.u-block-c06b-17 {font-size: 1rem} }</style>\n</section>","footerHtml":"<section class=\"u-align-center u-clearfix u-footer u-grey-90 u-block-7660-1\" custom-posts-hash=\"T\" data-style=\"footer-1-text\" data-post-id=\"post3\" data-section-properties=\"{&quot;grid-spacing&quot;:&quot;30&quot;,&quot;spacingAdditional&quot;:&quot;none&quot;,&quot;align&quot;:&quot;&quot;,&quot;stretch&quot;:true}\" id=\"sec-d012\" data-source=\"\" data-id=\"7660\">\n  <div class=\"u-clearfix u-sheet u-block-7660-2\">\n    <p class=\"u-small-text u-text u-text-variant u-block-7660-6\">Sample text. Click to select the text box. Click again or double click to start editing the text.</p>\n  </div>\n  <style data-mode=\"XL\" data-visited=\"true\">@media (min-width: 1200px){ .u-block-7660-1 {background-image: none}\n.u-block-7660-2 {min-height: 120px}\n.u-block-7660-6 {width: 417px; margin-top: 49px; margin-bottom: 49px; margin-left: auto; margin-right: auto} }</style>\n  <style data-mode=\"LG\">@media (max-width: 1199px) and (min-width: 992px){ .u-block-7660-1 {background-image: none}\n.u-block-7660-2 {min-height: 99px}\n.u-block-7660-6 {width: 417px; margin-top: 49px; margin-bottom: 49px; margin-left: auto; margin-right: auto} }</style>\n  <style data-mode=\"MD\">@media (max-width: 991px) and (min-width: 768px){ .u-block-7660-1 {background-image: none}\n.u-block-7660-2 {min-height: 76px}\n.u-block-7660-6 {width: 417px; margin-top: 49px; margin-bottom: 49px; margin-left: auto; margin-right: auto} }</style>\n  <style data-mode=\"SM\">@media (max-width: 767px) and (min-width: 576px){ .u-block-7660-1 {background-image: none}\n.u-block-7660-2 {min-height: 57px}\n.u-block-7660-6 {width: 417px; margin-top: 49px; margin-bottom: 49px; margin-left: auto; margin-right: auto} }</style>\n  <style data-mode=\"XS\">@media (max-width: 575px){ .u-block-7660-1 {background-image: none}\n.u-block-7660-2 {min-height: 36px}\n.u-block-7660-6 {width: 340px; margin-top: 49px; margin-bottom: 49px; margin-left: auto; margin-right: auto} }</style>\n</section>","hideBacklink":null,"homePageId":1736742,"dateUpdated":1649426310477,"settings":"{\"id\":0,\"colorScheme\":{\"bodyColors\":[\"#111111\",\"#ffffff\"],\"bgColor\":\"#ffffff\",\"colors\":[\"#16b6a1\",\"#db545a\",\"#f1a40e\",\"#1daad2\",\"#b9c1cc\"],\"shadingContrast\":\"body-alt-color\",\"whiteContrast\":\"body-color\",\"bgContrast\":\"body-color\",\"name\":\"u12\",\"customColors\":[]},\"fontScheme\":{\"name\":\"Roboto-OpenSans\",\"default\":true,\"isDefault\":true,\"fonts\":{\"heading\":\"Roboto, sans-serif\",\"text\":\"Open Sans, sans-serif\",\"accent\":\"Arial, sans-serif\",\"headingTitle\":\"Roboto\",\"textTitle\":\"Open Sans\"}},\"typography\":{\"name\":\"Normal\",\"isDefault\":true,\"title\":{\"font-weight\":\"400\",\"font-size\":4.5,\"line-height\":\"1_1\",\"margin-top\":20,\"margin-bottom\":20,\"SM\":{\"font-size\":3.75},\"XS\":{\"font-size\":3}},\"subtitle\":{\"font-weight\":\"400\",\"font-size\":2.25,\"line-height\":\"1_1\",\"margin-top\":20,\"margin-bottom\":20,\"XS\":{\"font-size\":1.5}},\"h1\":{\"font-weight\":\"400\",\"font-size\":3,\"line-height\":\"1_1\",\"margin-top\":20,\"margin-bottom\":20,\"XS\":{\"font-size\":1.875}},\"h2\":{\"font-weight\":\"400\",\"font-size\":2.25,\"line-height\":\"1_1\",\"margin-top\":20,\"margin-bottom\":20,\"XS\":{\"font-size\":1.5}},\"h3\":{\"font-weight\":\"400\",\"font-size\":1.875,\"line-height\":\"1_2\",\"margin-top\":20,\"margin-bottom\":20,\"XS\":{\"font-size\":1.5}},\"h4\":{\"font-weight\":\"400\",\"font-size\":1.5,\"line-height\":\"1_2\",\"margin-top\":20,\"margin-bottom\":20},\"h5\":{\"font-weight\":\"400\",\"font-size\":1.25,\"line-height\":\"1_2\",\"margin-top\":20,\"margin-bottom\":20},\"h6\":{\"font-weight\":\"400\",\"font-size\":1.125,\"line-height\":\"1_2\",\"margin-top\":20,\"margin-bottom\":20},\"largeText\":{\"font-size\":1.25,\"margin-top\":20,\"margin-bottom\":20},\"smallText\":{\"font-size\":0.875,\"margin-top\":20,\"margin-bottom\":20},\"text\":{\"margin-top\":20,\"margin-bottom\":20},\"hyperlink\":{\"text-color\":\"palette-1-base\"},\"link\":{},\"button\":{\"color\":\"palette-1-base\",\"margin-top\":20,\"margin-bottom\":20},\"blockquote\":{\"font-style\":\"italic\",\"indent\":20,\"border\":4,\"border-color\":\"palette-1-base\",\"margin-top\":20,\"margin-bottom\":20},\"metadata\":{\"margin-top\":20,\"margin-bottom\":20},\"list\":{\"margin-top\":20,\"margin-bottom\":20},\"orderedlist\":{\"margin-top\":20,\"margin-bottom\":20},\"postContent\":{\"margin-top\":20,\"margin-bottom\":20},\"theme\":{\"gradient\":\"\",\"image\":\"\",\"sheet-width-xl\":1140,\"sheet-width-lg\":940,\"sheet-width-md\":720,\"sheet-width-sm\":540,\"sheet-width-xs\":340},\"htmlBaseSize\":16},\"backToTop\":\"<span style=\\\"height: 64px; width: 64px; margin-left: 0px; margin-right: auto; margin-top: 0px; background-image: none; right: 20px; bottom: 20px\\\" class=\\\"u-back-to-top u-icon u-icon-circle u-opacity u-opacity-85 u-palette-1-base u-spacing-15\\\" data-href=\\\"#\\\">\\n        <svg class=\\\"u-svg-link\\\" preserveAspectRatio=\\\"xMidYMin slice\\\" viewBox=\\\"0 0 551.13 551.13\\\">\\n            <use xmlns:xlink=\\\"http://www.w3.org/1999/xlink\\\" xlink:href=\\\"#svg-1d98\\\"></use>\\n        </svg>\\n        <svg class=\\\"u-svg-content\\\" enable-background=\\\"new 0 0 551.13 551.13\\\" viewBox=\\\"0 0 551.13 551.13\\\" xmlns=\\\"http://www.w3.org/2000/svg\\\" id=\\\"svg-1d98\\\">\\n            <path d=\\\"m275.565 189.451 223.897 223.897h51.668l-275.565-275.565-275.565 275.565h51.668z\\\"></path>\\n        </svg>\\n    </span>\",\"cookiesSection\":\"<section class=\\\"u-align-center u-block-303d-1 u-clearfix u-cookies-consent u-grey-80\\\" custom-posts-hash=\\\"T\\\" style=\\\"background-image: none\\\" data-post-id=\\\"1\\\" data-section-properties=\\\"{&quot;stretch&quot;:true}\\\" data-id=\\\"303d\\\" data-posts-content=\\\"[{'images':[],'maps':[],'videos':[],'icons':[],'textWidth':874,'textHeight':152,'id':1,'headingProp':'h3','textProp':'text'}]\\\" data-style=\\\"cookie-1\\\" id=\\\"sec-79bb\\\" data-source=\\\"\\\">\\n  <div class=\\\"u-block-303d-2 u-clearfix u-sheet u-valign-middle\\\" style=\\\"min-height: 212px\\\" data-state=\\\"{&quot;margin-top&quot;:{&quot;shouldApplyDefaultMargins&quot;:{&quot;XL&quot;:false,&quot;LG&quot;:false,&quot;MD&quot;:false,&quot;SM&quot;:false,&quot;XS&quot;:false},&quot;parentVerticalAlign&quot;:{&quot;XL&quot;:&quot;middle&quot;,&quot;LG&quot;:&quot;middle&quot;,&quot;MD&quot;:&quot;middle&quot;,&quot;SM&quot;:&quot;middle&quot;,&quot;XS&quot;:&quot;middle&quot;}},&quot;margin-bottom&quot;:{&quot;shouldApplyDefaultMargins&quot;:{&quot;XL&quot;:false,&quot;LG&quot;:false,&quot;MD&quot;:false,&quot;SM&quot;:false,&quot;XS&quot;:false},&quot;parentVerticalAlign&quot;:{&quot;XL&quot;:&quot;middle&quot;,&quot;LG&quot;:&quot;middle&quot;,&quot;MD&quot;:&quot;middle&quot;,&quot;SM&quot;:&quot;middle&quot;,&quot;XS&quot;:&quot;middle&quot;}}}\\\" data-height-lg=\\\"158\\\" data-height-md=\\\"131\\\" data-height-sm=\\\"106\\\" data-height-xs=\\\"225\\\">\\n    <div class=\\\"u-block-303d-7 u-clearfix u-expanded-width u-layout-wrap\\\" style=\\\"margin-top: 30px; margin-bottom: 30px\\\" data-state=\\\"{&quot;margin-top&quot;:{&quot;shouldApplyDefaultMargins&quot;:{&quot;XL&quot;:false,&quot;LG&quot;:false,&quot;MD&quot;:false,&quot;SM&quot;:true,&quot;XS&quot;:true},&quot;parentVerticalAlign&quot;:{&quot;XL&quot;:&quot;middle&quot;,&quot;LG&quot;:&quot;middle&quot;,&quot;MD&quot;:&quot;middle&quot;,&quot;SM&quot;:&quot;middle&quot;,&quot;XS&quot;:&quot;middle&quot;}},&quot;margin-bottom&quot;:{&quot;shouldApplyDefaultMargins&quot;:{&quot;XL&quot;:false,&quot;LG&quot;:false,&quot;MD&quot;:false,&quot;SM&quot;:true,&quot;XS&quot;:true},&quot;parentVerticalAlign&quot;:{&quot;XL&quot;:&quot;middle&quot;,&quot;LG&quot;:&quot;middle&quot;,&quot;MD&quot;:&quot;middle&quot;,&quot;SM&quot;:&quot;middle&quot;,&quot;XS&quot;:&quot;middle&quot;}}}\\\">\\n      <div class=\\\"u-gutter-0 u-layout\\\">\\n        <div class=\\\"u-layout-row\\\">\\n          <div class=\\\"u-block-303d-8 u-container-style u-layout-cell u-left-cell u-size-43-md u-size-43-sm u-size-43-xs u-size-46-lg u-size-46-xl\\\" style=\\\"min-height: 152px\\\" data-state=\\\"{&quot;min-height&quot;:{&quot;expandedParent&quot;:{&quot;XL&quot;:true,&quot;LG&quot;:true,&quot;MD&quot;:true,&quot;SM&quot;:true,&quot;XS&quot;:true},&quot;cellMultiplier&quot;:{&quot;XL&quot;:1,&quot;LG&quot;:1,&quot;MD&quot;:0.9347826086956521,&quot;SM&quot;:1.3953488372093024,&quot;XS&quot;:1},&quot;canCollapse&quot;:{&quot;XL&quot;:false,&quot;LG&quot;:false,&quot;MD&quot;:true,&quot;SM&quot;:true,&quot;XS&quot;:true}}}\\\">\\n            <div class=\\\"u-block-303d-9 u-container-layout u-valign-middle\\\" style=\\\"padding-top: 30px; padding-bottom: 30px; padding-left: 60px; padding-right: 60px\\\" data-state=\\\"{&quot;min-height&quot;:{&quot;canCollapse&quot;:{&quot;XL&quot;:false,&quot;LG&quot;:false,&quot;MD&quot;:false,&quot;SM&quot;:false,&quot;XS&quot;:false}}}\\\">\\n              <h3 class=\\\"u-block-303d-6 u-text u-text-default\\\" style=\\\"margin-top: 0px; margin-right: 20px; margin-bottom: 0px;\\\">Cookies &amp; Privacy</h3>\\n              <p class=\\\"u-block-303d-5 u-text u-text-default\\\" style=\\\"margin: 8px 20px 0px 0px;\\\">This website uses cookies to ensure you get the best experience on our website.</p>\\n            </div>\\n          </div>\\n          <div class=\\\"u-align-left u-block-303d-10 u-container-style u-layout-cell u-right-cell u-size-14-lg u-size-14-xl u-size-17-md u-size-17-sm u-size-17-xs\\\" style=\\\"min-height: 152px\\\" data-state=\\\"{&quot;min-height&quot;:{&quot;expandedParent&quot;:{&quot;XL&quot;:true,&quot;LG&quot;:true,&quot;MD&quot;:true,&quot;SM&quot;:true,&quot;XS&quot;:true},&quot;cellMultiplier&quot;:{&quot;XL&quot;:1,&quot;LG&quot;:1,&quot;MD&quot;:1.2142857142857142,&quot;SM&quot;:3.5294117647058822,&quot;XS&quot;:1},&quot;canCollapse&quot;:{&quot;XL&quot;:false,&quot;LG&quot;:false,&quot;MD&quot;:true,&quot;SM&quot;:true,&quot;XS&quot;:true}}}\\\">\\n            <div class=\\\"u-block-303d-11 u-container-layout u-valign-middle-lg u-valign-middle-md u-valign-middle-xl u-valign-top-sm u-valign-top-xs\\\" style=\\\"padding-top: 30px; padding-bottom: 30px; padding-left: 30px; padding-right: 30px\\\" data-state=\\\"{&quot;min-height&quot;:{&quot;canCollapse&quot;:{&quot;XL&quot;:false,&quot;LG&quot;:false,&quot;MD&quot;:false,&quot;SM&quot;:false,&quot;XS&quot;:false}}}\\\">\\n              <a href=\\\"###\\\" class=\\\"u-block-303d-3 u-btn u-button-confirm u-button-style u-palette-1-base\\\" style=\\\"margin-top: 0px; margin-right: auto; margin-bottom: 0px; margin-left: 0px\\\">Confirm</a>\\n            </div>\\n          </div>\\n        </div>\\n      </div>\\n    </div>\\n  </div>\\n  <style data-mode=\\\"XL\\\">@media (max-width: 0px) { .u-block-303d-1 {background-image: none}\\n.u-block-303d-2 {min-height: 212px}\\n.u-block-303d-7 {margin-top: 30px; margin-bottom: 30px}\\n.u-block-303d-8 {min-height: 152px}\\n.u-block-303d-9 {padding-top: 30px; padding-bottom: 30px; padding-left: 60px; padding-right: 60px}\\n.u-block-303d-6 {margin-top: 0px; margin-right: 20px; margin-bottom: 0px}\\n.u-block-303d-5 {margin-top: 8px; margin-right: 20px; margin-bottom: 0px; margin-left: 0px}\\n.u-block-303d-10 {min-height: 152px}\\n.u-block-303d-11 {padding-top: 30px; padding-bottom: 30px; padding-left: 30px; padding-right: 30px}\\n.u-block-303d-3 {margin-top: 0px; margin-right: auto; margin-bottom: 0px; margin-left: 0px} }</style>\\n  <style data-mode=\\\"LG\\\">@media (max-width: 0px) { .u-block-303d-1 {background-image: none}\\n.u-block-303d-2 {min-height: 131px}\\n.u-block-303d-7 {margin-top: 30px; margin-bottom: 30px}\\n.u-block-303d-8 {min-height: 125px}\\n.u-block-303d-9 {padding-top: 30px; padding-bottom: 30px; padding-left: 60px; padding-right: 60px}\\n.u-block-303d-6 {margin-top: 0px; margin-right: 0px; margin-bottom: 0px}\\n.u-block-303d-5 {margin-top: 8px; margin-right: 0px; margin-bottom: 0px; margin-left: 0px}\\n.u-block-303d-10 {min-height: 125px}\\n.u-block-303d-11 {padding-top: 30px; padding-bottom: 30px; padding-left: 30px; padding-right: 30px}\\n.u-block-303d-3 {margin-top: 0px; margin-right: auto; margin-bottom: 0px; margin-left: 0px} }</style>\\n  <style data-mode=\\\"MD\\\" data-visited=\\\"true\\\">@media (max-width: 0px) { .u-block-303d-1 {background-image: none}\\n.u-block-303d-2 {min-height: 106px}\\n.u-block-303d-7 {margin-top: 30px; margin-bottom: 30px}\\n.u-block-303d-8 {min-height: 100px}\\n.u-block-303d-9 {padding-top: 30px; padding-bottom: 30px; padding-left: 30px; padding-right: 30px}\\n.u-block-303d-6 {margin-top: 0px; margin-right: 0px; margin-bottom: 0px}\\n.u-block-303d-5 {margin-top: 8px; margin-right: 0px; margin-bottom: 0px; margin-left: 0px}\\n.u-block-303d-10 {min-height: 100px}\\n.u-block-303d-11 {padding-top: 30px; padding-bottom: 30px; padding-left: 30px; padding-right: 30px}\\n.u-block-303d-3 {margin-top: 0px; margin-right: auto; margin-bottom: 0px; margin-left: 0px} }</style>\\n  <style data-mode=\\\"SM\\\" data-visited=\\\"true\\\">@media (max-width: 0px) { .u-block-303d-1 {background-image: none}\\n.u-block-303d-2 {min-height: 225px}\\n.u-block-303d-7 {margin-top: 30px; margin-bottom: 30px}\\n.u-block-303d-8 {min-height: 154px}\\n.u-block-303d-9 {padding-top: 30px; padding-left: 10px; padding-right: 10px; padding-bottom: 20px}\\n.u-block-303d-6 {margin-top: 0px; margin-right: 0px; margin-bottom: 0px}\\n.u-block-303d-5 {margin-top: 8px; margin-right: 0px; margin-bottom: 0px; margin-left: 0px}\\n.u-block-303d-10 {min-height: 65px}\\n.u-block-303d-11 {padding-top: 10px; padding-bottom: 10px; padding-left: 10px; padding-right: 10px}\\n.u-block-303d-3 {margin-top: 0px; margin-right: auto; margin-bottom: 0px; margin-left: 0px} }</style>\\n  <style data-mode=\\\"XS\\\" data-visited=\\\"true\\\">@media (max-width: 0px) { .u-block-303d-1 {background-image: none}\\n.u-block-303d-2 {min-height: 121px}\\n.u-block-303d-7 {margin-top: 30px; margin-bottom: 30px}\\n.u-block-303d-8 {min-height: 100px}\\n.u-block-303d-9 {padding-top: 30px; padding-bottom: 20px; padding-left: 10px; padding-right: 10px}\\n.u-block-303d-6 {margin-top: 0px; margin-right: 0px; margin-bottom: 0px}\\n.u-block-303d-5 {margin-top: 8px; margin-right: 0px; margin-bottom: 0px; margin-left: 0px}\\n.u-block-303d-10 {min-height: 15px}\\n.u-block-303d-11 {padding-top: 10px; padding-bottom: 10px; padding-left: 10px; padding-right: 10px}\\n.u-block-303d-3 {margin-top: 0px; margin-right: auto; margin-bottom: 0px; margin-left: 0px} }</style>\\n</section>\",\"themeBackLinks\":\"\",\"blog\":\"{\\\"posts\\\":{\\\"items\\\":[]}}\",\"domain\":\"\"}","dialog":null,"title":"WebSite1736741","siteStyleCss":"<style id=\"color-scheme\" color-scheme=\"u12\" color-style=\"monochrome-5\">.u-body {\n--none: transparent;\n--none-darker: transparent;\n--none-r: 255;\n--none-g: 255;\n--none-b: 255;\n--none-contrast: body-color;\n--none-contrast-darker: body-color;\n--none-text-color: var(--body-color);\n--transparent: transparent;\n--transparent-darker: transparent;\n--transparent-r: 255;\n--transparent-g: 255;\n--transparent-b: 255;\n--transparent-contrast: body-color;\n--transparent-contrast-darker: body-color;\n--transparent-text-color: var(--body-color);\n--body-color: #111111;\n--body-color-darker: #0f0f0f;\n--body-color-r: 17;\n--body-color-g: 17;\n--body-color-b: 17;\n--body-color-contrast: white;\n--body-color-contrast-darker: white;\n--body-color-text-color: var(--body-alt-color);\n--body-alt-color: #ffffff;\n--body-alt-color-darker: #e6e6e6;\n--body-alt-color-r: 255;\n--body-alt-color-g: 255;\n--body-alt-color-b: 255;\n--body-alt-color-contrast: black;\n--body-alt-color-contrast-darker: black;\n--body-alt-color-text-color: var(--body-color);\n--bg-color: #ffffff;\n--bg-color-darker: #e6e6e6;\n--bg-color-r: 255;\n--bg-color-g: 255;\n--bg-color-b: 255;\n--bg-color-contrast: black;\n--bg-color-contrast-darker: black;\n--bg-color-text-color: var(--body-color);\n--palette-1-base: #16b6a1;\n--palette-1-base-darker: #14a491;\n--palette-1-base-r: 22;\n--palette-1-base-g: 182;\n--palette-1-base-b: 161;\n--palette-1-base-contrast: white;\n--palette-1-base-contrast-darker: white;\n--palette-1-base-text-color: var(--body-alt-color);\n--palette-1-dark-3: #293332;\n--palette-1-dark-3-darker: #252e2d;\n--palette-1-dark-3-r: 41;\n--palette-1-dark-3-g: 51;\n--palette-1-dark-3-b: 50;\n--palette-1-dark-3-contrast: white;\n--palette-1-dark-3-contrast-darker: white;\n--palette-1-dark-3-text-color: var(--body-alt-color);\n--palette-1-dark-2: #36756c;\n--palette-1-dark-2-darker: #316961;\n--palette-1-dark-2-r: 54;\n--palette-1-dark-2-g: 117;\n--palette-1-dark-2-b: 108;\n--palette-1-dark-2-contrast: white;\n--palette-1-dark-2-contrast-darker: white;\n--palette-1-dark-2-text-color: var(--body-alt-color);\n--palette-1-dark-1: #16b6a1;\n--palette-1-dark-1-darker: #14a491;\n--palette-1-dark-1-r: 22;\n--palette-1-dark-1-g: 182;\n--palette-1-dark-1-b: 161;\n--palette-1-dark-1-contrast: white;\n--palette-1-dark-1-contrast-darker: white;\n--palette-1-dark-1-text-color: var(--body-alt-color);\n--palette-1: #2fedd4;\n--palette-1-darker: #15ebcf;\n--palette-1-r: 47;\n--palette-1-g: 237;\n--palette-1-b: 212;\n--palette-1-contrast: black;\n--palette-1-contrast-darker: black;\n--palette-1-text-color: var(--body-color);\n--palette-1-light-1: #6af3e1;\n--palette-1-light-1-darker: #4af0da;\n--palette-1-light-1-r: 106;\n--palette-1-light-1-g: 243;\n--palette-1-light-1-b: 225;\n--palette-1-light-1-contrast: black;\n--palette-1-light-1-contrast-darker: black;\n--palette-1-light-1-text-color: var(--body-color);\n--palette-1-light-2: #a8f8ee;\n--palette-1-light-2-darker: #81f5e6;\n--palette-1-light-2-r: 168;\n--palette-1-light-2-g: 248;\n--palette-1-light-2-b: 238;\n--palette-1-light-2-contrast: black;\n--palette-1-light-2-contrast-darker: black;\n--palette-1-light-2-text-color: var(--body-color);\n--palette-1-light-3: #e9fdfb;\n--palette-1-light-3-darker: #bcf9f3;\n--palette-1-light-3-r: 233;\n--palette-1-light-3-g: 253;\n--palette-1-light-3-b: 251;\n--palette-1-light-3-contrast: black;\n--palette-1-light-3-contrast-darker: black;\n--palette-1-light-3-text-color: var(--body-color);\n--palette-2-base: #db545a;\n--palette-2-base-darker: #d63b42;\n--palette-2-base-r: 219;\n--palette-2-base-g: 84;\n--palette-2-base-b: 90;\n--palette-2-base-contrast: white;\n--palette-2-base-contrast-darker: white;\n--palette-2-base-text-color: var(--body-alt-color);\n--palette-2-dark-3: #332929;\n--palette-2-dark-3-darker: #2e2525;\n--palette-2-dark-3-r: 51;\n--palette-2-dark-3-g: 41;\n--palette-2-dark-3-b: 41;\n--palette-2-dark-3-contrast: white;\n--palette-2-dark-3-contrast-darker: white;\n--palette-2-dark-3-text-color: var(--body-alt-color);\n--palette-2-dark-2: #6b4748;\n--palette-2-dark-2-darker: #604041;\n--palette-2-dark-2-r: 107;\n--palette-2-dark-2-g: 71;\n--palette-2-dark-2-b: 72;\n--palette-2-dark-2-contrast: white;\n--palette-2-dark-2-contrast-darker: white;\n--palette-2-dark-2-text-color: var(--body-alt-color);\n--palette-2-dark-1: #a35559;\n--palette-2-dark-1-darker: #934c50;\n--palette-2-dark-1-r: 163;\n--palette-2-dark-1-g: 85;\n--palette-2-dark-1-b: 89;\n--palette-2-dark-1-contrast: white;\n--palette-2-dark-1-contrast-darker: white;\n--palette-2-dark-1-text-color: var(--body-alt-color);\n--palette-2: #db545a;\n--palette-2-darker: #d63b42;\n--palette-2-r: 219;\n--palette-2-g: 84;\n--palette-2-b: 90;\n--palette-2-contrast: white;\n--palette-2-contrast-darker: white;\n--palette-2-text-color: var(--body-alt-color);\n--palette-2-light-1: #e68387;\n--palette-2-light-1-darker: #e0656a;\n--palette-2-light-1-r: 230;\n--palette-2-light-1-g: 131;\n--palette-2-light-1-b: 135;\n--palette-2-light-1-contrast: white;\n--palette-2-light-1-contrast-darker: white;\n--palette-2-light-1-text-color: var(--body-alt-color);\n--palette-2-light-2: #f1b5b8;\n--palette-2-light-2-darker: #ea9296;\n--palette-2-light-2-r: 241;\n--palette-2-light-2-g: 181;\n--palette-2-light-2-b: 184;\n--palette-2-light-2-contrast: black;\n--palette-2-light-2-contrast-darker: white;\n--palette-2-light-2-text-color: var(--body-color);\n--palette-2-light-3: #fbeced;\n--palette-2-light-3-darker: #f3c4c7;\n--palette-2-light-3-r: 251;\n--palette-2-light-3-g: 236;\n--palette-2-light-3-b: 237;\n--palette-2-light-3-contrast: black;\n--palette-2-light-3-contrast-darker: black;\n--palette-2-light-3-text-color: var(--body-color);\n--palette-3-base: #f1a40e;\n--palette-3-base-darker: #d9940d;\n--palette-3-base-r: 241;\n--palette-3-base-g: 164;\n--palette-3-base-b: 14;\n--palette-3-base-contrast: white;\n--palette-3-base-contrast-darker: white;\n--palette-3-base-text-color: var(--body-alt-color);\n--palette-3-dark-3: #333029;\n--palette-3-dark-3-darker: #2e2b25;\n--palette-3-dark-3-r: 51;\n--palette-3-dark-3-g: 48;\n--palette-3-dark-3-b: 41;\n--palette-3-dark-3-contrast: white;\n--palette-3-dark-3-contrast-darker: white;\n--palette-3-dark-3-text-color: var(--body-alt-color);\n--palette-3-dark-2: #72613f;\n--palette-3-dark-2-darker: #675739;\n--palette-3-dark-2-r: 114;\n--palette-3-dark-2-g: 97;\n--palette-3-dark-2-b: 63;\n--palette-3-dark-2-contrast: white;\n--palette-3-dark-2-contrast-darker: white;\n--palette-3-dark-2-text-color: var(--body-alt-color);\n--palette-3-dark-1: #b28836;\n--palette-3-dark-1-darker: #a07a31;\n--palette-3-dark-1-r: 178;\n--palette-3-dark-1-g: 136;\n--palette-3-dark-1-b: 54;\n--palette-3-dark-1-contrast: white;\n--palette-3-dark-1-contrast-darker: white;\n--palette-3-dark-1-text-color: var(--body-alt-color);\n--palette-3: #f1a40e;\n--palette-3-darker: #d9940d;\n--palette-3-r: 241;\n--palette-3-g: 164;\n--palette-3-b: 14;\n--palette-3-contrast: white;\n--palette-3-contrast-darker: white;\n--palette-3-text-color: var(--body-alt-color);\n--palette-3-light-1: #f5be54;\n--palette-3-light-1-darker: #f3b235;\n--palette-3-light-1-r: 245;\n--palette-3-light-1-g: 190;\n--palette-3-light-1-b: 84;\n--palette-3-light-1-contrast: black;\n--palette-3-light-1-contrast-darker: black;\n--palette-3-light-1-text-color: var(--body-color);\n--palette-3-light-2: #f9da9b;\n--palette-3-light-2-darker: #f7cc75;\n--palette-3-light-2-r: 249;\n--palette-3-light-2-g: 218;\n--palette-3-light-2-b: 155;\n--palette-3-light-2-contrast: black;\n--palette-3-light-2-contrast-darker: black;\n--palette-3-light-2-text-color: var(--body-color);\n--palette-3-light-3: #fef5e6;\n--palette-3-light-3-darker: #fce2b7;\n--palette-3-light-3-r: 254;\n--palette-3-light-3-g: 245;\n--palette-3-light-3-b: 230;\n--palette-3-light-3-contrast: black;\n--palette-3-light-3-contrast-darker: black;\n--palette-3-light-3-text-color: var(--body-color);\n--palette-4-base: #1daad2;\n--palette-4-base-darker: #1a99bd;\n--palette-4-base-r: 29;\n--palette-4-base-g: 170;\n--palette-4-base-b: 210;\n--palette-4-base-contrast: white;\n--palette-4-base-contrast-darker: white;\n--palette-4-base-text-color: var(--body-alt-color);\n--palette-4-dark-3: #293133;\n--palette-4-dark-3-darker: #252c2e;\n--palette-4-dark-3-r: 41;\n--palette-4-dark-3-g: 49;\n--palette-4-dark-3-b: 51;\n--palette-4-dark-3-contrast: white;\n--palette-4-dark-3-contrast-darker: white;\n--palette-4-dark-3-text-color: var(--body-alt-color);\n--palette-4-dark-2: #3d7383;\n--palette-4-dark-2-darker: #376776;\n--palette-4-dark-2-r: 61;\n--palette-4-dark-2-g: 115;\n--palette-4-dark-2-b: 131;\n--palette-4-dark-2-contrast: white;\n--palette-4-dark-2-contrast-darker: white;\n--palette-4-dark-2-text-color: var(--body-alt-color);\n--palette-4-dark-1: #1daad2;\n--palette-4-dark-1-darker: #1a99bd;\n--palette-4-dark-1-r: 29;\n--palette-4-dark-1-g: 170;\n--palette-4-dark-1-b: 210;\n--palette-4-dark-1-contrast: white;\n--palette-4-dark-1-contrast-darker: white;\n--palette-4-dark-1-text-color: var(--body-alt-color);\n--palette-4: #2bc4ef;\n--palette-4-darker: #12bcec;\n--palette-4-r: 43;\n--palette-4-g: 196;\n--palette-4-b: 239;\n--palette-4-contrast: white;\n--palette-4-contrast-darker: white;\n--palette-4-text-color: var(--body-alt-color);\n--palette-4-light-1: #68d5f4;\n--palette-4-light-1-darker: #48ccf2;\n--palette-4-light-1-r: 104;\n--palette-4-light-1-g: 213;\n--palette-4-light-1-b: 244;\n--palette-4-light-1-contrast: black;\n--palette-4-light-1-contrast-darker: black;\n--palette-4-light-1-text-color: var(--body-color);\n--palette-4-light-2: #a7e7f9;\n--palette-4-light-2-darker: #80dcf6;\n--palette-4-light-2-r: 167;\n--palette-4-light-2-g: 231;\n--palette-4-light-2-b: 249;\n--palette-4-light-2-contrast: black;\n--palette-4-light-2-contrast-darker: black;\n--palette-4-light-2-text-color: var(--body-color);\n--palette-4-light-3: #e9f9fd;\n--palette-4-light-3-darker: #bcedf9;\n--palette-4-light-3-r: 233;\n--palette-4-light-3-g: 249;\n--palette-4-light-3-b: 253;\n--palette-4-light-3-contrast: black;\n--palette-4-light-3-contrast-darker: black;\n--palette-4-light-3-text-color: var(--body-color);\n--palette-5-base: #b9c1cc;\n--palette-5-base-darker: #a2adbc;\n--palette-5-base-r: 185;\n--palette-5-base-g: 193;\n--palette-5-base-b: 204;\n--palette-5-base-contrast: black;\n--palette-5-base-contrast-darker: white;\n--palette-5-base-text-color: var(--body-color);\n--palette-5-dark-3: #292d33;\n--palette-5-dark-3-darker: #25292e;\n--palette-5-dark-3-r: 41;\n--palette-5-dark-3-g: 45;\n--palette-5-dark-3-b: 51;\n--palette-5-dark-3-contrast: white;\n--palette-5-dark-3-contrast-darker: white;\n--palette-5-dark-3-text-color: var(--body-alt-color);\n--palette-5-dark-2: #555c66;\n--palette-5-dark-2-darker: #4d535c;\n--palette-5-dark-2-r: 85;\n--palette-5-dark-2-g: 92;\n--palette-5-dark-2-b: 102;\n--palette-5-dark-2-contrast: white;\n--palette-5-dark-2-contrast-darker: white;\n--palette-5-dark-2-text-color: var(--body-alt-color);\n--palette-5-dark-1: #858e99;\n--palette-5-dark-1-darker: #75808c;\n--palette-5-dark-1-r: 133;\n--palette-5-dark-1-g: 142;\n--palette-5-dark-1-b: 153;\n--palette-5-dark-1-contrast: white;\n--palette-5-dark-1-contrast-darker: white;\n--palette-5-dark-1-text-color: var(--body-alt-color);\n--palette-5: #b9c1cc;\n--palette-5-darker: #a2adbc;\n--palette-5-r: 185;\n--palette-5-g: 193;\n--palette-5-b: 204;\n--palette-5-contrast: black;\n--palette-5-contrast-darker: white;\n--palette-5-text-color: var(--body-color);\n--palette-5-light-1: #ccd3db;\n--palette-5-light-1-darker: #b3bec9;\n--palette-5-light-1-r: 204;\n--palette-5-light-1-g: 211;\n--palette-5-light-1-b: 219;\n--palette-5-light-1-contrast: black;\n--palette-5-light-1-contrast-darker: black;\n--palette-5-light-1-text-color: var(--body-color);\n--palette-5-light-2: #e0e5eb;\n--palette-5-light-2-darker: #c4ced9;\n--palette-5-light-2-r: 224;\n--palette-5-light-2-g: 229;\n--palette-5-light-2-b: 235;\n--palette-5-light-2-contrast: black;\n--palette-5-light-2-contrast-darker: black;\n--palette-5-light-2-text-color: var(--body-color);\n--palette-5-light-3: #f5f7fa;\n--palette-5-light-3-darker: #d4dde9;\n--palette-5-light-3-r: 245;\n--palette-5-light-3-g: 247;\n--palette-5-light-3-b: 250;\n--palette-5-light-3-contrast: black;\n--palette-5-light-3-contrast-darker: black;\n--palette-5-light-3-text-color: var(--body-color);\n--grey-40: #999999;\n--grey-40-darker: #8a8a8a;\n--grey-40-r: 153;\n--grey-40-g: 153;\n--grey-40-b: 153;\n--grey-40-contrast: white;\n--grey-40-contrast-darker: white;\n--grey-40-text-color: var(--body-alt-color);\n--grey-30: #b3b3b3;\n--grey-30-darker: #a1a1a1;\n--grey-30-r: 179;\n--grey-30-g: 179;\n--grey-30-b: 179;\n--grey-30-contrast: white;\n--grey-30-contrast-darker: white;\n--grey-30-text-color: var(--body-alt-color);\n--grey-25: #c0c0c0;\n--grey-25-darker: #adadad;\n--grey-25-r: 192;\n--grey-25-g: 192;\n--grey-25-b: 192;\n--grey-25-contrast: black;\n--grey-25-contrast-darker: white;\n--grey-25-text-color: var(--body-color);\n--white: #ffffff;\n--white-darker: #e6e6e6;\n--white-r: 255;\n--white-g: 255;\n--white-b: 255;\n--white-contrast: black;\n--white-contrast-darker: black;\n--white-text-color: var(--body-color);\n--grey-15: #d9d9d9;\n--grey-15-darker: #c3c3c3;\n--grey-15-r: 217;\n--grey-15-g: 217;\n--grey-15-b: 217;\n--grey-15-contrast: black;\n--grey-15-contrast-darker: black;\n--grey-15-text-color: var(--body-color);\n--grey-10: #e5e5e5;\n--grey-10-darker: #cecece;\n--grey-10-r: 229;\n--grey-10-g: 229;\n--grey-10-b: 229;\n--grey-10-contrast: black;\n--grey-10-contrast-darker: black;\n--grey-10-text-color: var(--body-color);\n--grey-5: #f2f2f2;\n--grey-5-darker: #dadada;\n--grey-5-r: 242;\n--grey-5-g: 242;\n--grey-5-b: 242;\n--grey-5-contrast: black;\n--grey-5-contrast-darker: black;\n--grey-5-text-color: var(--body-color);\n--grey-90: #1a1a1a;\n--grey-90-darker: #171717;\n--grey-90-r: 26;\n--grey-90-g: 26;\n--grey-90-b: 26;\n--grey-90-contrast: white;\n--grey-90-contrast-darker: white;\n--grey-90-text-color: var(--body-alt-color);\n--grey-80: #333333;\n--grey-80-darker: #2e2e2e;\n--grey-80-r: 51;\n--grey-80-g: 51;\n--grey-80-b: 51;\n--grey-80-contrast: white;\n--grey-80-contrast-darker: white;\n--grey-80-text-color: var(--body-alt-color);\n--grey-75: #404040;\n--grey-75-darker: #3a3a3a;\n--grey-75-r: 64;\n--grey-75-g: 64;\n--grey-75-b: 64;\n--grey-75-contrast: white;\n--grey-75-contrast-darker: white;\n--grey-75-text-color: var(--body-alt-color);\n--black: #000000;\n--black-darker: #000000;\n--black-r: 0;\n--black-g: 0;\n--black-b: 0;\n--black-contrast: white;\n--black-contrast-darker: white;\n--black-text-color: var(--body-alt-color);\n--grey-70: #4d4d4d;\n--grey-70-darker: #454545;\n--grey-70-r: 77;\n--grey-70-g: 77;\n--grey-70-b: 77;\n--grey-70-contrast: white;\n--grey-70-contrast-darker: white;\n--grey-70-text-color: var(--body-alt-color);\n--grey-60: #666666;\n--grey-60-darker: #5c5c5c;\n--grey-60-r: 102;\n--grey-60-g: 102;\n--grey-60-b: 102;\n--grey-60-contrast: white;\n--grey-60-contrast-darker: white;\n--grey-60-text-color: var(--body-alt-color);\n--grey-50: #808080;\n--grey-50-darker: #737373;\n--grey-50-r: 128;\n--grey-50-g: 128;\n--grey-50-b: 128;\n--grey-50-contrast: white;\n--grey-50-contrast-darker: white;\n--grey-50-text-color: var(--body-alt-color);\n--grey-dark-3: #212121;\n--grey-dark-3-darker: #1e1e1e;\n--grey-dark-3-r: 33;\n--grey-dark-3-g: 33;\n--grey-dark-3-b: 33;\n--grey-dark-3-contrast: white;\n--grey-dark-3-contrast-darker: white;\n--grey-dark-3-text-color: var(--body-alt-color);\n--grey-dark-2: #333333;\n--grey-dark-2-darker: #2e2e2e;\n--grey-dark-2-r: 51;\n--grey-dark-2-g: 51;\n--grey-dark-2-b: 51;\n--grey-dark-2-contrast: white;\n--grey-dark-2-contrast-darker: white;\n--grey-dark-2-text-color: var(--body-alt-color);\n--grey-dark-1: #454545;\n--grey-dark-1-darker: #3e3e3e;\n--grey-dark-1-r: 69;\n--grey-dark-1-g: 69;\n--grey-dark-1-b: 69;\n--grey-dark-1-contrast: white;\n--grey-dark-1-contrast-darker: white;\n--grey-dark-1-text-color: var(--body-alt-color);\n--grey: #b3b3b3;\n--grey-darker: #a1a1a1;\n--grey-r: 179;\n--grey-g: 179;\n--grey-b: 179;\n--grey-contrast: white;\n--grey-contrast-darker: white;\n--grey-text-color: var(--body-alt-color);\n--grey-light-1: #d9d9d9;\n--grey-light-1-darker: #c3c3c3;\n--grey-light-1-r: 217;\n--grey-light-1-g: 217;\n--grey-light-1-b: 217;\n--grey-light-1-contrast: black;\n--grey-light-1-contrast-darker: black;\n--grey-light-1-text-color: var(--body-color);\n--grey-light-2: #eeeeee;\n--grey-light-2-darker: #d6d6d6;\n--grey-light-2-r: 238;\n--grey-light-2-g: 238;\n--grey-light-2-b: 238;\n--grey-light-2-contrast: black;\n--grey-light-2-contrast-darker: black;\n--grey-light-2-text-color: var(--body-color);\n--grey-light-3: #f6f6f6;\n--grey-light-3-darker: #dddddd;\n--grey-light-3-r: 246;\n--grey-light-3-g: 246;\n--grey-light-3-b: 246;\n--grey-light-3-contrast: black;\n--grey-light-3-contrast-darker: black;\n--grey-light-3-text-color: var(--body-color);\n--color-1-base: #b9c1cc;\n--color-1-base-darker: #a2adbc;\n--color-1-base-r: 185;\n--color-1-base-g: 193;\n--color-1-base-b: 204;\n--color-1-base-contrast: black;\n--color-1-base-contrast-darker: white;\n--color-1-base-text-color: var(--body-color);\n--color-1-dark-3: #292d33;\n--color-1-dark-3-darker: #25292e;\n--color-1-dark-3-r: 41;\n--color-1-dark-3-g: 45;\n--color-1-dark-3-b: 51;\n--color-1-dark-3-contrast: white;\n--color-1-dark-3-contrast-darker: white;\n--color-1-dark-3-text-color: var(--body-alt-color);\n--color-1-dark-2: #555c66;\n--color-1-dark-2-darker: #4d535c;\n--color-1-dark-2-r: 85;\n--color-1-dark-2-g: 92;\n--color-1-dark-2-b: 102;\n--color-1-dark-2-contrast: white;\n--color-1-dark-2-contrast-darker: white;\n--color-1-dark-2-text-color: var(--body-alt-color);\n--color-1-dark-1: #858e99;\n--color-1-dark-1-darker: #75808c;\n--color-1-dark-1-r: 133;\n--color-1-dark-1-g: 142;\n--color-1-dark-1-b: 153;\n--color-1-dark-1-contrast: white;\n--color-1-dark-1-contrast-darker: white;\n--color-1-dark-1-text-color: var(--body-alt-color);\n--color-1: #b9c1cc;\n--color-1-darker: #a2adbc;\n--color-1-r: 185;\n--color-1-g: 193;\n--color-1-b: 204;\n--color-1-contrast: black;\n--color-1-contrast-darker: white;\n--color-1-text-color: var(--body-color);\n--color-1-light-1: #ccd3db;\n--color-1-light-1-darker: #b3bec9;\n--color-1-light-1-r: 204;\n--color-1-light-1-g: 211;\n--color-1-light-1-b: 219;\n--color-1-light-1-contrast: black;\n--color-1-light-1-contrast-darker: black;\n--color-1-light-1-text-color: var(--body-color);\n--color-1-light-2: #e0e5eb;\n--color-1-light-2-darker: #c4ced9;\n--color-1-light-2-r: 224;\n--color-1-light-2-g: 229;\n--color-1-light-2-b: 235;\n--color-1-light-2-contrast: black;\n--color-1-light-2-contrast-darker: black;\n--color-1-light-2-text-color: var(--body-color);\n--color-1-light-3: #f5f7fa;\n--color-1-light-3-darker: #d4dde9;\n--color-1-light-3-r: 245;\n--color-1-light-3-g: 247;\n--color-1-light-3-b: 250;\n--color-1-light-3-contrast: black;\n--color-1-light-3-contrast-darker: black;\n--color-1-light-3-text-color: var(--body-color);\n--color-2-base: #16b6a1;\n--color-2-base-darker: #14a491;\n--color-2-base-r: 22;\n--color-2-base-g: 182;\n--color-2-base-b: 161;\n--color-2-base-contrast: white;\n--color-2-base-contrast-darker: white;\n--color-2-base-text-color: var(--body-alt-color);\n--color-2-dark-3: #293332;\n--color-2-dark-3-darker: #252e2d;\n--color-2-dark-3-r: 41;\n--color-2-dark-3-g: 51;\n--color-2-dark-3-b: 50;\n--color-2-dark-3-contrast: white;\n--color-2-dark-3-contrast-darker: white;\n--color-2-dark-3-text-color: var(--body-alt-color);\n--color-2-dark-2: #36756c;\n--color-2-dark-2-darker: #316961;\n--color-2-dark-2-r: 54;\n--color-2-dark-2-g: 117;\n--color-2-dark-2-b: 108;\n--color-2-dark-2-contrast: white;\n--color-2-dark-2-contrast-darker: white;\n--color-2-dark-2-text-color: var(--body-alt-color);\n--color-2-dark-1: #16b6a1;\n--color-2-dark-1-darker: #14a491;\n--color-2-dark-1-r: 22;\n--color-2-dark-1-g: 182;\n--color-2-dark-1-b: 161;\n--color-2-dark-1-contrast: white;\n--color-2-dark-1-contrast-darker: white;\n--color-2-dark-1-text-color: var(--body-alt-color);\n--color-2: #2fedd4;\n--color-2-darker: #15ebcf;\n--color-2-r: 47;\n--color-2-g: 237;\n--color-2-b: 212;\n--color-2-contrast: black;\n--color-2-contrast-darker: black;\n--color-2-text-color: var(--body-color);\n--color-2-light-1: #6af3e1;\n--color-2-light-1-darker: #4af0da;\n--color-2-light-1-r: 106;\n--color-2-light-1-g: 243;\n--color-2-light-1-b: 225;\n--color-2-light-1-contrast: black;\n--color-2-light-1-contrast-darker: black;\n--color-2-light-1-text-color: var(--body-color);\n--color-2-light-2: #a8f8ee;\n--color-2-light-2-darker: #81f5e6;\n--color-2-light-2-r: 168;\n--color-2-light-2-g: 248;\n--color-2-light-2-b: 238;\n--color-2-light-2-contrast: black;\n--color-2-light-2-contrast-darker: black;\n--color-2-light-2-text-color: var(--body-color);\n--color-2-light-3: #e9fdfb;\n--color-2-light-3-darker: #bcf9f3;\n--color-2-light-3-r: 233;\n--color-2-light-3-g: 253;\n--color-2-light-3-b: 251;\n--color-2-light-3-contrast: black;\n--color-2-light-3-contrast-darker: black;\n--color-2-light-3-text-color: var(--body-color);\n--color-3-base: #db545a;\n--color-3-base-darker: #d63b42;\n--color-3-base-r: 219;\n--color-3-base-g: 84;\n--color-3-base-b: 90;\n--color-3-base-contrast: white;\n--color-3-base-contrast-darker: white;\n--color-3-base-text-color: var(--body-alt-color);\n--color-3-dark-3: #332929;\n--color-3-dark-3-darker: #2e2525;\n--color-3-dark-3-r: 51;\n--color-3-dark-3-g: 41;\n--color-3-dark-3-b: 41;\n--color-3-dark-3-contrast: white;\n--color-3-dark-3-contrast-darker: white;\n--color-3-dark-3-text-color: var(--body-alt-color);\n--color-3-dark-2: #6b4748;\n--color-3-dark-2-darker: #604041;\n--color-3-dark-2-r: 107;\n--color-3-dark-2-g: 71;\n--color-3-dark-2-b: 72;\n--color-3-dark-2-contrast: white;\n--color-3-dark-2-contrast-darker: white;\n--color-3-dark-2-text-color: var(--body-alt-color);\n--color-3-dark-1: #a35559;\n--color-3-dark-1-darker: #934c50;\n--color-3-dark-1-r: 163;\n--color-3-dark-1-g: 85;\n--color-3-dark-1-b: 89;\n--color-3-dark-1-contrast: white;\n--color-3-dark-1-contrast-darker: white;\n--color-3-dark-1-text-color: var(--body-alt-color);\n--color-3: #db545a;\n--color-3-darker: #d63b42;\n--color-3-r: 219;\n--color-3-g: 84;\n--color-3-b: 90;\n--color-3-contrast: white;\n--color-3-contrast-darker: white;\n--color-3-text-color: var(--body-alt-color);\n--color-3-light-1: #e68387;\n--color-3-light-1-darker: #e0656a;\n--color-3-light-1-r: 230;\n--color-3-light-1-g: 131;\n--color-3-light-1-b: 135;\n--color-3-light-1-contrast: white;\n--color-3-light-1-contrast-darker: white;\n--color-3-light-1-text-color: var(--body-alt-color);\n--color-3-light-2: #f1b5b8;\n--color-3-light-2-darker: #ea9296;\n--color-3-light-2-r: 241;\n--color-3-light-2-g: 181;\n--color-3-light-2-b: 184;\n--color-3-light-2-contrast: black;\n--color-3-light-2-contrast-darker: white;\n--color-3-light-2-text-color: var(--body-color);\n--color-3-light-3: #fbeced;\n--color-3-light-3-darker: #f3c4c7;\n--color-3-light-3-r: 251;\n--color-3-light-3-g: 236;\n--color-3-light-3-b: 237;\n--color-3-light-3-contrast: black;\n--color-3-light-3-contrast-darker: black;\n--color-3-light-3-text-color: var(--body-color);\n--color-4-base: #f1a40e;\n--color-4-base-darker: #d9940d;\n--color-4-base-r: 241;\n--color-4-base-g: 164;\n--color-4-base-b: 14;\n--color-4-base-contrast: white;\n--color-4-base-contrast-darker: white;\n--color-4-base-text-color: var(--body-alt-color);\n--color-4-dark-3: #333029;\n--color-4-dark-3-darker: #2e2b25;\n--color-4-dark-3-r: 51;\n--color-4-dark-3-g: 48;\n--color-4-dark-3-b: 41;\n--color-4-dark-3-contrast: white;\n--color-4-dark-3-contrast-darker: white;\n--color-4-dark-3-text-color: var(--body-alt-color);\n--color-4-dark-2: #72613f;\n--color-4-dark-2-darker: #675739;\n--color-4-dark-2-r: 114;\n--color-4-dark-2-g: 97;\n--color-4-dark-2-b: 63;\n--color-4-dark-2-contrast: white;\n--color-4-dark-2-contrast-darker: white;\n--color-4-dark-2-text-color: var(--body-alt-color);\n--color-4-dark-1: #b28836;\n--color-4-dark-1-darker: #a07a31;\n--color-4-dark-1-r: 178;\n--color-4-dark-1-g: 136;\n--color-4-dark-1-b: 54;\n--color-4-dark-1-contrast: white;\n--color-4-dark-1-contrast-darker: white;\n--color-4-dark-1-text-color: var(--body-alt-color);\n--color-4: #f1a40e;\n--color-4-darker: #d9940d;\n--color-4-r: 241;\n--color-4-g: 164;\n--color-4-b: 14;\n--color-4-contrast: white;\n--color-4-contrast-darker: white;\n--color-4-text-color: var(--body-alt-color);\n--color-4-light-1: #f5be54;\n--color-4-light-1-darker: #f3b235;\n--color-4-light-1-r: 245;\n--color-4-light-1-g: 190;\n--color-4-light-1-b: 84;\n--color-4-light-1-contrast: black;\n--color-4-light-1-contrast-darker: black;\n--color-4-light-1-text-color: var(--body-color);\n--color-4-light-2: #f9da9b;\n--color-4-light-2-darker: #f7cc75;\n--color-4-light-2-r: 249;\n--color-4-light-2-g: 218;\n--color-4-light-2-b: 155;\n--color-4-light-2-contrast: black;\n--color-4-light-2-contrast-darker: black;\n--color-4-light-2-text-color: var(--body-color);\n--color-4-light-3: #fef5e6;\n--color-4-light-3-darker: #fce2b7;\n--color-4-light-3-r: 254;\n--color-4-light-3-g: 245;\n--color-4-light-3-b: 230;\n--color-4-light-3-contrast: black;\n--color-4-light-3-contrast-darker: black;\n--color-4-light-3-text-color: var(--body-color);\n--color-5-base: #1daad2;\n--color-5-base-darker: #1a99bd;\n--color-5-base-r: 29;\n--color-5-base-g: 170;\n--color-5-base-b: 210;\n--color-5-base-contrast: white;\n--color-5-base-contrast-darker: white;\n--color-5-base-text-color: var(--body-alt-color);\n--color-5-dark-3: #293133;\n--color-5-dark-3-darker: #252c2e;\n--color-5-dark-3-r: 41;\n--color-5-dark-3-g: 49;\n--color-5-dark-3-b: 51;\n--color-5-dark-3-contrast: white;\n--color-5-dark-3-contrast-darker: white;\n--color-5-dark-3-text-color: var(--body-alt-color);\n--color-5-dark-2: #3d7383;\n--color-5-dark-2-darker: #376776;\n--color-5-dark-2-r: 61;\n--color-5-dark-2-g: 115;\n--color-5-dark-2-b: 131;\n--color-5-dark-2-contrast: white;\n--color-5-dark-2-contrast-darker: white;\n--color-5-dark-2-text-color: var(--body-alt-color);\n--color-5-dark-1: #1daad2;\n--color-5-dark-1-darker: #1a99bd;\n--color-5-dark-1-r: 29;\n--color-5-dark-1-g: 170;\n--color-5-dark-1-b: 210;\n--color-5-dark-1-contrast: white;\n--color-5-dark-1-contrast-darker: white;\n--color-5-dark-1-text-color: var(--body-alt-color);\n--color-5: #2bc4ef;\n--color-5-darker: #12bcec;\n--color-5-r: 43;\n--color-5-g: 196;\n--color-5-b: 239;\n--color-5-contrast: white;\n--color-5-contrast-darker: white;\n--color-5-text-color: var(--body-alt-color);\n--color-5-light-1: #68d5f4;\n--color-5-light-1-darker: #48ccf2;\n--color-5-light-1-r: 104;\n--color-5-light-1-g: 213;\n--color-5-light-1-b: 244;\n--color-5-light-1-contrast: black;\n--color-5-light-1-contrast-darker: black;\n--color-5-light-1-text-color: var(--body-color);\n--color-5-light-2: #a7e7f9;\n--color-5-light-2-darker: #80dcf6;\n--color-5-light-2-r: 167;\n--color-5-light-2-g: 231;\n--color-5-light-2-b: 249;\n--color-5-light-2-contrast: black;\n--color-5-light-2-contrast-darker: black;\n--color-5-light-2-text-color: var(--body-color);\n--color-5-light-3: #e9f9fd;\n--color-5-light-3-darker: #bcedf9;\n--color-5-light-3-r: 233;\n--color-5-light-3-g: 249;\n--color-5-light-3-b: 253;\n--color-5-light-3-contrast: black;\n--color-5-light-3-contrast-darker: black;\n--color-5-light-3-text-color: var(--body-color);\n--white-contrast: var(--body-color);\n--shading-contrast: var(--body-alt-color);\n--bg-contrast: var(--body-color);\n}</style><style id=\"typography\" typography=\"Normal\">\n        .u-body\n        {\n        --title-font-weight: 400;\n        --title-font-size: 4.5rem;\n        --title-line-height: 1.1;\n        --title-margin-top: 20px;\n        --title-margin-bottom: 20px;\n        --subtitle-font-weight: 400;\n        --subtitle-font-size: 2.25rem;\n        --subtitle-line-height: 1.1;\n        --subtitle-margin-top: 20px;\n        --subtitle-margin-bottom: 20px;\n        --h1-font-weight: 400;\n        --h1-font-size: 3rem;\n        --h1-line-height: 1.1;\n        --h1-margin-top: 20px;\n        --h1-margin-bottom: 20px;\n        --h2-font-weight: 400;\n        --h2-font-size: 2.25rem;\n        --h2-line-height: 1.1;\n        --h2-margin-top: 20px;\n        --h2-margin-bottom: 20px;\n        --h3-font-weight: 400;\n        --h3-font-size: 1.875rem;\n        --h3-line-height: 1.2;\n        --h3-margin-top: 20px;\n        --h3-margin-bottom: 20px;\n        --h4-font-weight: 400;\n        --h4-font-size: 1.5rem;\n        --h4-line-height: 1.2;\n        --h4-margin-top: 20px;\n        --h4-margin-bottom: 20px;\n        --h5-font-weight: 400;\n        --h5-font-size: 1.25rem;\n        --h5-line-height: 1.2;\n        --h5-margin-top: 20px;\n        --h5-margin-bottom: 20px;\n        --h6-font-weight: 400;\n        --h6-font-size: 1.125rem;\n        --h6-line-height: 1.2;\n        --h6-margin-top: 20px;\n        --h6-margin-bottom: 20px;\n        --largeText-font-size: 1.25rem;\n        --largeText-margin-top: 20px;\n        --largeText-margin-bottom: 20px;\n        --smallText-font-size: 0.875rem;\n        --smallText-margin-top: 20px;\n        --smallText-margin-bottom: 20px;\n        --text-margin-top: 20px;\n        --text-margin-bottom: 20px;\n        --hyperlink-color: var(--palette-1-base);\n        --hyperlink-alt-text-color: var(--palette-1-light-2);\n        --hyperlink-hover-color: var(--palette-1-base-darker);\n        --hyperlink-hover-alt-text-color: var(--grey-30-darker);\n        --button-margin-top: 20px;\n        --button-margin-bottom: 20px;\n        --button-background-color: var(--palette-1-base);\n        --button-color: var(--white);\n        --button-alt-background-color: var(--palette-1-light-2);\n        --button-alt-color: var(--black);\n        --button-hover-background-color: var(--palette-1-base-darker);\n        --button-hover-color: var(--white-darker);\n        --button-hover-alt-background-color: var(--palette-1-light-2-darker);\n        --button-hover-alt-color: var(--white);\n        --button-hover-background-color: var(--palette-1-base-darker);\n        --button-hover-color: var(--white-darker);\n        --button-hover-alt-background-color: var(--palette-1-light-2-darker);\n        --button-hover-alt-color: var(--white);\n        --button-active-background-color: var(--palette-1-base-darker);\n        --button-active-color: var(--white-darker);\n        --button-active-alt-background-color: var(--palette-1-light-2-darker);\n        --button-active-alt-color: var(--white);\n        --blockquote-font-style: italic;\n        --blockquote-padding-left: 20px;\n        --blockquote-border-width: 4px;\n        --blockquote-border-color: var(--palette-1-base);\n        --blockquote-margin-top: 20px;\n        --blockquote-margin-bottom: 20px;\n        --metadata-margin-top: 20px;\n        --metadata-margin-bottom: 20px;\n        --list-margin-top: 20px;\n        --list-margin-bottom: 20px;\n        --orderedlist-margin-top: 20px;\n        --orderedlist-margin-bottom: 20px;\n        --postContent-margin-top: 20px;\n        --postContent-margin-bottom: 20px;\n        --theme-sheet-width-xl: 1140px;\n        --theme-sheet-width-lg: 940px;\n        --theme-sheet-width-md: 720px;\n        --theme-sheet-width-sm: 540px;\n        --theme-sheet-width-xs: 340px;\n        --title-font-size-sm: 3.75rem;\n        --title-font-size-xs: 3rem;\n        --subtitle-font-size-xs: 1.5rem;\n        --h1-font-size-xs: 1.875rem;\n        --h2-font-size-xs: 1.5rem;\n        --h3-font-size-xs: 1.5rem;\n        }\n\n        /** common-rules **/\n        h1.u-title\n        {\n        font-weight: var(--title-font-weight);\n        font-size: var(--title-font-size);\n        line-height: var(--title-line-height);\n        margin-top: var(--title-margin-top);\n        margin-bottom: var(--title-margin-bottom);\n        }\n        h2.u-subtitle\n        {\n        font-weight: var(--subtitle-font-weight);\n        font-size: var(--subtitle-font-size);\n        line-height: var(--subtitle-line-height);\n        margin-top: var(--subtitle-margin-top);\n        margin-bottom: var(--subtitle-margin-bottom);\n        }\n        h1:not(.u-title)\n        {\n        font-weight: var(--h1-font-weight);\n        font-size: var(--h1-font-size);\n        line-height: var(--h1-line-height);\n        margin-top: var(--h1-margin-top);\n        margin-bottom: var(--h1-margin-bottom);\n        }\n        h2:not(.u-subtitle)\n        {\n        font-weight: var(--h2-font-weight);\n        font-size: var(--h2-font-size);\n        line-height: var(--h2-line-height);\n        margin-top: var(--h2-margin-top);\n        margin-bottom: var(--h2-margin-bottom);\n        }\n        h3\n        {\n        font-weight: var(--h3-font-weight);\n        font-size: var(--h3-font-size);\n        line-height: var(--h3-line-height);\n        margin-top: var(--h3-margin-top);\n        margin-bottom: var(--h3-margin-bottom);\n        }\n        h4\n        {\n        font-weight: var(--h4-font-weight);\n        font-size: var(--h4-font-size);\n        line-height: var(--h4-line-height);\n        margin-top: var(--h4-margin-top);\n        margin-bottom: var(--h4-margin-bottom);\n        }\n        h5\n        {\n        font-weight: var(--h5-font-weight);\n        font-size: var(--h5-font-size);\n        line-height: var(--h5-line-height);\n        margin-top: var(--h5-margin-top);\n        margin-bottom: var(--h5-margin-bottom);\n        }\n        h6\n        {\n        font-weight: var(--h6-font-weight);\n        font-size: var(--h6-font-size);\n        line-height: var(--h6-line-height);\n        margin-top: var(--h6-margin-top);\n        margin-bottom: var(--h6-margin-bottom);\n        }\n        p.u-large-text\n        {\n        font-size: var(--largeText-font-size);\n        margin-top: var(--largeText-margin-top);\n        margin-bottom: var(--largeText-margin-bottom);\n        }\n        p.u-small-text\n        {\n        font-size: var(--smallText-font-size);\n        margin-top: var(--smallText-margin-top);\n        margin-bottom: var(--smallText-margin-bottom);\n        }\n        p:not(.u-text-variant)\n        {\n        margin-top: var(--text-margin-top);\n        margin-bottom: var(--text-margin-bottom);\n        }\n        .u-btn\n        {\n        margin-top: var(--button-margin-top);\n        margin-bottom: var(--button-margin-bottom);\n        }\n        blockquote\n        {\n        font-style: var(--blockquote-font-style);\n        padding-left: var(--blockquote-padding-left);\n        border-width: var(--blockquote-border-width);\n        margin-top: var(--blockquote-margin-top);\n        margin-bottom: var(--blockquote-margin-bottom);\n        }\n        .u-metadata\n        {\n        margin-top: var(--metadata-margin-top);\n        margin-bottom: var(--metadata-margin-bottom);\n        }\n        ul:not(.u-unstyled)\n        {\n        margin-top: var(--list-margin-top);\n        margin-bottom: var(--list-margin-bottom);\n        }\n        ol\n        {\n        margin-top: var(--orderedlist-margin-top);\n        margin-bottom: var(--orderedlist-margin-bottom);\n        }\n        .u-post-content\n        {\n        margin-top: var(--postContent-margin-top);\n        margin-bottom: var(--postContent-margin-bottom);\n        }\n        /** common-rules **/\n\n        /** publish-rules **/\n        /*begin-media rules*/\n        @media (max-width: 767px) {\n        h1.u-title\n        {\n        font-size: var(--title-font-size-sm);\n        }\n        }\n        @media (max-width: 575px) {\n        h1.u-title\n        {\n        font-size: var(--title-font-size-xs);\n        }\n        }\n        @media (max-width: 575px) {\n        h2.u-subtitle\n        {\n        font-size: var(--subtitle-font-size-xs);\n        }\n        }\n        @media (max-width: 575px) {\n        h1:not(.u-title)\n        {\n        font-size: var(--h1-font-size-xs);\n        }\n        }\n        @media (max-width: 575px) {\n        h2:not(.u-subtitle)\n        {\n        font-size: var(--h2-font-size-xs);\n        }\n        }\n        @media (max-width: 575px) {\n        h3\n        {\n        font-size: var(--h3-font-size-xs);\n        }\n        }\n        /*end-media rules*/\n        /** publish-rules **/\n\n        \n\n        /** cms-rules **/\n        /*begin-responsive rules*/\n        .u-sm h1.u-title\n        {\n        font-size: var(--title-font-size-sm);\n        }\n        .u-xs h1.u-title\n        {\n        font-size: var(--title-font-size-xs);\n        }\n        .u-xs h2.u-subtitle\n        {\n        font-size: var(--subtitle-font-size-xs);\n        }\n        .u-xs h1:not(.u-title)\n        {\n        font-size: var(--h1-font-size-xs);\n        }\n        .u-xs h2:not(.u-subtitle)\n        {\n        font-size: var(--h2-font-size-xs);\n        }\n        .u-xs h3\n        {\n        font-size: var(--h3-font-size-xs);\n        }\n        /*end-responsive rules*/\n        /** cms-rules **/\n\n        /** color-rules **/\n        .u-overlap.u-overlap-transparent:not(.u-overlap-contrast) .u-header :not(.u-nav-item) > a,\n        .u-gradient > .u-container-layout > a,\n        .u-image:not(.u-shading) > .u-container-layout > a,\n        a\n        {\n        color: var(--hyperlink-color);\n        }\n        .u-overlap.u-overlap-transparent:not(.u-overlap-contrast) .u-header :not(.u-nav-item) > a:hover,\n        .u-gradient > .u-container-layout > a:hover,\n        .u-image:not(.u-shading) > .u-container-layout > a:hover,\n        a:hover\n        {\n        color: var(--hyperlink-hover-color);\n        }\n        .u-overlap.u-overlap-transparent:not(.u-overlap-contrast) .u-header :not(.u-nav-item) > .u-btn,\n        .u-gradient > .u-container-layout > .u-btn,\n        .u-image:not(.u-shading) > .u-container-layout > .u-btn,\n        .u-btn\n        {\n        background-color: var(--button-background-color);\n        color: var(--button-color);\n        }\n        .u-overlap.u-overlap-transparent:not(.u-overlap-contrast) .u-header :not(.u-nav-item) > .u-btn:hover,\n        .u-gradient > .u-container-layout > .u-btn:hover,\n        .u-image:not(.u-shading) > .u-container-layout > .u-btn:hover,\n        .u-btn:hover\n        {\n        background-color: var(--button-hover-background-color);\n        color: var(--button-hover-color);\n        }\n        .u-overlap.u-overlap-transparent:not(.u-overlap-contrast) .u-header :not(.u-nav-item) > .u-btn:focus,\n        .u-gradient > .u-container-layout > .u-btn:focus,\n        .u-image:not(.u-shading) > .u-container-layout > .u-btn:focus,\n        .u-btn:focus\n        {\n        background-color: var(--button-hover-background-color);\n        color: var(--button-hover-color);\n        }\n        .u-overlap.u-overlap-transparent:not(.u-overlap-contrast) .u-header :not(.u-nav-item) > .u-btn:active,\n        .u-gradient > .u-container-layout > .u-btn:active,\n        .u-image:not(.u-shading) > .u-container-layout > .u-btn:active,\n        .u-btn:active\n        {\n        background-color: var(--button-active-background-color);\n        color: var(--button-active-color);\n        }\n        .u-overlap.u-overlap-transparent:not(.u-overlap-contrast) .u-header :not(.u-nav-item) > blockquote,\n        .u-gradient > .u-container-layout > blockquote,\n        .u-image:not(.u-shading) > .u-container-layout > blockquote,\n        blockquote\n        {\n        border-color: var(--blockquote-border-color);\n        }\n        /** color-rules **/\n\n        /** alt-color-rules **/\n        .u-body-color a,.u-palette-1-base a,.u-palette-1-dark-3 a,.u-palette-1-dark-2 a,.u-palette-1-dark-1 a,.u-palette-2-base a,.u-palette-2-dark-3 a,.u-palette-2-dark-2 a,.u-palette-2-dark-1 a,.u-palette-2 a,.u-palette-2-light-1 a,.u-palette-3-base a,.u-palette-3-dark-3 a,.u-palette-3-dark-2 a,.u-palette-3-dark-1 a,.u-palette-3 a,.u-palette-4-base a,.u-palette-4-dark-3 a,.u-palette-4-dark-2 a,.u-palette-4-dark-1 a,.u-palette-4 a,.u-palette-5-dark-3 a,.u-palette-5-dark-2 a,.u-palette-5-dark-1 a,.u-grey-40 a,.u-grey-30 a,.u-grey-90 a,.u-grey-80 a,.u-grey-75 a,.u-black a,.u-grey-70 a,.u-grey-60 a,.u-grey-50 a,.u-grey-dark-3 a,.u-grey-dark-2 a,.u-grey-dark-1 a,.u-grey a,.u-shading a,.u-overlap-contrast .u-header a:not(.u-nav-link):not(.u-btn)\n        {\n        color: var(--hyperlink-alt-text-color);\n        }\n        .u-body-color a:hover,.u-palette-1-base a:hover,.u-palette-1-dark-3 a:hover,.u-palette-1-dark-2 a:hover,.u-palette-1-dark-1 a:hover,.u-palette-2-base a:hover,.u-palette-2-dark-3 a:hover,.u-palette-2-dark-2 a:hover,.u-palette-2-dark-1 a:hover,.u-palette-2 a:hover,.u-palette-2-light-1 a:hover,.u-palette-3-base a:hover,.u-palette-3-dark-3 a:hover,.u-palette-3-dark-2 a:hover,.u-palette-3-dark-1 a:hover,.u-palette-3 a:hover,.u-palette-4-base a:hover,.u-palette-4-dark-3 a:hover,.u-palette-4-dark-2 a:hover,.u-palette-4-dark-1 a:hover,.u-palette-4 a:hover,.u-palette-5-dark-3 a:hover,.u-palette-5-dark-2 a:hover,.u-palette-5-dark-1 a:hover,.u-grey-40 a:hover,.u-grey-30 a:hover,.u-grey-90 a:hover,.u-grey-80 a:hover,.u-grey-75 a:hover,.u-black a:hover,.u-grey-70 a:hover,.u-grey-60 a:hover,.u-grey-50 a:hover,.u-grey-dark-3 a:hover,.u-grey-dark-2 a:hover,.u-grey-dark-1 a:hover,.u-grey a:hover\n        {\n        color: var(--hyperlink-hover-alt-text-color);\n        }\n        .u-body-color .u-btn,.u-palette-1-base .u-btn,.u-palette-1-dark-3 .u-btn,.u-palette-1-dark-2 .u-btn,.u-palette-1-dark-1 .u-btn,.u-palette-2-base .u-btn,.u-palette-2-dark-3 .u-btn,.u-palette-2-dark-2 .u-btn,.u-palette-2-dark-1 .u-btn,.u-palette-2 .u-btn,.u-palette-2-light-1 .u-btn,.u-palette-3-base .u-btn,.u-palette-3-dark-3 .u-btn,.u-palette-3-dark-2 .u-btn,.u-palette-3-dark-1 .u-btn,.u-palette-3 .u-btn,.u-palette-4-base .u-btn,.u-palette-4-dark-3 .u-btn,.u-palette-4-dark-2 .u-btn,.u-palette-4-dark-1 .u-btn,.u-palette-4 .u-btn,.u-palette-5-dark-3 .u-btn,.u-palette-5-dark-2 .u-btn,.u-palette-5-dark-1 .u-btn,.u-grey-40 .u-btn,.u-grey-30 .u-btn,.u-grey-90 .u-btn,.u-grey-80 .u-btn,.u-grey-75 .u-btn,.u-black .u-btn,.u-grey-70 .u-btn,.u-grey-60 .u-btn,.u-grey-50 .u-btn,.u-grey-dark-3 .u-btn,.u-grey-dark-2 .u-btn,.u-grey-dark-1 .u-btn,.u-grey .u-btn,.u-shading .u-btn,.u-overlap-contrast .u-header .u-btn\n        {\n        background-color: var(--button-alt-background-color);\n        color: var(--button-alt-color);\n        }\n        .u-body-color .u-btn:hover,.u-palette-1-base .u-btn:hover,.u-palette-1-dark-3 .u-btn:hover,.u-palette-1-dark-2 .u-btn:hover,.u-palette-1-dark-1 .u-btn:hover,.u-palette-2-base .u-btn:hover,.u-palette-2-dark-3 .u-btn:hover,.u-palette-2-dark-2 .u-btn:hover,.u-palette-2-dark-1 .u-btn:hover,.u-palette-2 .u-btn:hover,.u-palette-2-light-1 .u-btn:hover,.u-palette-3-base .u-btn:hover,.u-palette-3-dark-3 .u-btn:hover,.u-palette-3-dark-2 .u-btn:hover,.u-palette-3-dark-1 .u-btn:hover,.u-palette-3 .u-btn:hover,.u-palette-4-base .u-btn:hover,.u-palette-4-dark-3 .u-btn:hover,.u-palette-4-dark-2 .u-btn:hover,.u-palette-4-dark-1 .u-btn:hover,.u-palette-4 .u-btn:hover,.u-palette-5-dark-3 .u-btn:hover,.u-palette-5-dark-2 .u-btn:hover,.u-palette-5-dark-1 .u-btn:hover,.u-grey-40 .u-btn:hover,.u-grey-30 .u-btn:hover,.u-grey-90 .u-btn:hover,.u-grey-80 .u-btn:hover,.u-grey-75 .u-btn:hover,.u-black .u-btn:hover,.u-grey-70 .u-btn:hover,.u-grey-60 .u-btn:hover,.u-grey-50 .u-btn:hover,.u-grey-dark-3 .u-btn:hover,.u-grey-dark-2 .u-btn:hover,.u-grey-dark-1 .u-btn:hover,.u-grey .u-btn:hover,.u-shading .u-btn:hover,.u-overlap-contrast .u-header .u-btn:hover\n        {\n        background-color: var(--button-hover-alt-background-color);\n        color: var(--button-hover-alt-color);\n        }\n        .u-body-color .u-btn:active,.u-palette-1-base .u-btn:active,.u-palette-1-dark-3 .u-btn:active,.u-palette-1-dark-2 .u-btn:active,.u-palette-1-dark-1 .u-btn:active,.u-palette-2-base .u-btn:active,.u-palette-2-dark-3 .u-btn:active,.u-palette-2-dark-2 .u-btn:active,.u-palette-2-dark-1 .u-btn:active,.u-palette-2 .u-btn:active,.u-palette-2-light-1 .u-btn:active,.u-palette-3-base .u-btn:active,.u-palette-3-dark-3 .u-btn:active,.u-palette-3-dark-2 .u-btn:active,.u-palette-3-dark-1 .u-btn:active,.u-palette-3 .u-btn:active,.u-palette-4-base .u-btn:active,.u-palette-4-dark-3 .u-btn:active,.u-palette-4-dark-2 .u-btn:active,.u-palette-4-dark-1 .u-btn:active,.u-palette-4 .u-btn:active,.u-palette-5-dark-3 .u-btn:active,.u-palette-5-dark-2 .u-btn:active,.u-palette-5-dark-1 .u-btn:active,.u-grey-40 .u-btn:active,.u-grey-30 .u-btn:active,.u-grey-90 .u-btn:active,.u-grey-80 .u-btn:active,.u-grey-75 .u-btn:active,.u-black .u-btn:active,.u-grey-70 .u-btn:active,.u-grey-60 .u-btn:active,.u-grey-50 .u-btn:active,.u-grey-dark-3 .u-btn:active,.u-grey-dark-2 .u-btn:active,.u-grey-dark-1 .u-btn:active,.u-grey .u-btn:active,.u-shading .u-btn:active,.u-overlap-contrast .u-header .u-btn:active\n        {\n        background-color: var(--button-active-alt-background-color);\n        color: var(--button-active-alt-color);\n        }\n        /** alt-color-rules **/\n    </style><style id=\"font-scheme\" font-scheme=\"Roboto-OpenSans\" heading-font=\"Roboto,sans-serif\" text-font=\"'Open Sans',sans-serif\">.u-body {\n   --text-font: 'Open Sans',sans-serif;\n   --heading-font: Roboto,sans-serif;\n}</style>","appVersion":"4.8.2","isTrial":false}